{
  "schema_version": 1,
  "acceptance_id": "p4-13-v1",
  "status": "frozen",
  "baseline_ref": "contracts/tool-execution/tool-execution-baseline.v1.json",
  "source_scenarios_ref": "tests/fixtures/tool-execution/p4-01-v1.json",
  "tool_drill_manifest_ref": "tests/fixtures/tool-execution/p4-12-v1.json",
  "synthetic": true,
  "description": "在同一次本地联合验收中复用阶段 4 已通过的真实测试，验证工具目录、状态事实、内部 Adapter、计划、确认审批、凭证、幂等副作用、恢复、结果运营、控制台和故障演练。",
  "execution_policy": {
    "preflight_command": "./platform doctor",
    "recovery_command": "./platform doctor",
    "stop_scenarios_on_preflight_failure": true,
    "always_run_recovery_check": true,
    "failure_mode": "fail_closed",
    "evidence_path": ".ai-platform/evidence/p4-13-latest.json"
  },
  "required_invariants": [
    "p4_release_tool_allowlist",
    "p4_deterministic_execution_boundary",
    "p4_tool_version_immutable",
    "p4_current_policy_recheck",
    "p4_read_write_permission_separation",
    "p4_confirmation_digest_binding",
    "p4_idempotency_before_side_effect",
    "p4_credential_call_edge_only",
    "p4_bounded_retry_and_terminal_precedence",
    "p4_transactional_fact_consistency",
    "p4_untrusted_result_quarantine",
    "p4_restricted_adapter_surface"
  ],
  "required_gates": [
    "unauthorized_tool_denial",
    "unconfirmed_side_effect_denial",
    "zero_duplicate_side_effect",
    "step_attempt_traceability",
    "zero_credential_exposure",
    "cancellation_late_result_precedence"
  ],
  "required_capabilities": [
    "catalog_allowlist",
    "immutable_tool_version",
    "task_traceability",
    "internal_read_adapters",
    "deterministic_planning",
    "current_policy_authorization",
    "personal_confirmation",
    "enterprise_approval",
    "credential_boundary",
    "side_effect_idempotency",
    "response_loss_recovery",
    "cancellation_precedence",
    "result_usage_sse_audit",
    "console_http_authorization",
    "fault_drill_contract"
  ],
  "scenarios": [
    {
      "scenario_id": "p413-catalog-allowlist-001",
      "title": "Release 工具白名单与当前目录交集",
      "capability": "catalog_allowlist",
      "source_case_refs": ["p401-personal-read-allowed-001", "p401-release-allowlist-denied-004"],
      "pytest_node": "tests/integration/test_p402_tool_catalog_postgres.py::test_real_personal_plan_and_rbac_only_narrow_platform_catalog",
      "expected_case_count": 1,
      "verified_invariants": ["p4_release_tool_allowlist", "p4_current_policy_recheck"],
      "verified_gates": ["unauthorized_tool_denial"],
      "success_criteria": "个人套餐、Release 白名单和当前权限只取交集，越界工具无法进入可执行目录。"
    },
    {
      "scenario_id": "p413-immutable-version-002",
      "title": "工具版本与 Adapter 安全属性不可变",
      "capability": "immutable_tool_version",
      "source_case_refs": ["p401-unregistered-version-denied-005", "p401-arbitrary-http-denied-022"],
      "pytest_node": "tests/integration/test_p402_tool_catalog_postgres.py::test_database_rejects_mutation_unsafe_adapter_and_destructive_downgrade",
      "expected_case_count": 1,
      "verified_invariants": ["p4_tool_version_immutable", "p4_restricted_adapter_surface"],
      "verified_gates": ["unauthorized_tool_denial"],
      "success_criteria": "数据库拒绝篡改已登记版本、扩大 Adapter 表面或破坏性降级。"
    },
    {
      "scenario_id": "p413-task-traceability-003",
      "title": "Run、Step、Attempt 与终态追溯",
      "capability": "task_traceability",
      "source_case_refs": ["p401-cancel-before-attempt-017", "p401-late-success-ignored-019"],
      "pytest_node": "tests/integration/test_p403_tool_task_state_postgres.py::test_idempotent_ordered_lifecycle_and_terminal_database_protection",
      "expected_case_count": 1,
      "verified_invariants": ["p4_bounded_retry_and_terminal_precedence", "p4_transactional_fact_consistency"],
      "verified_gates": ["step_attempt_traceability", "cancellation_late_result_precedence"],
      "success_criteria": "状态事实按顺序可追溯，数据库拒绝跳步、伪造 Attempt 和覆盖终态。"
    },
    {
      "scenario_id": "p413-read-adapters-004",
      "title": "五个内部只读 Adapter 受控执行",
      "capability": "internal_read_adapters",
      "source_case_refs": ["p401-personal-read-allowed-001", "p401-arbitrary-http-denied-022"],
      "pytest_node": "tests/integration/test_p404_internal_read_adapters_postgres.py::test_real_catalog_executes_all_five_internal_read_adapters",
      "expected_case_count": 1,
      "verified_invariants": ["p4_release_tool_allowlist", "p4_current_policy_recheck", "p4_restricted_adapter_surface"],
      "verified_gates": ["unauthorized_tool_denial"],
      "success_criteria": "五个固定只读工具只能经统一 Adapter 和当前授权执行，不能退化为任意 HTTP、SQL 或文件访问。"
    },
    {
      "scenario_id": "p413-planning-policy-005",
      "title": "执行计划冻结与策略失败关闭",
      "capability": "deterministic_planning",
      "source_case_refs": ["p401-draft-tool-denied-003", "p401-policy-unavailable-denied-008"],
      "pytest_node": "tests/integration/test_p405_tool_planning_postgres.py::test_real_release_plan_freezes_budget_policy_and_blocks_database_bypass",
      "expected_case_count": 1,
      "verified_invariants": ["p4_release_tool_allowlist", "p4_deterministic_execution_boundary", "p4_current_policy_recheck"],
      "verified_gates": ["unauthorized_tool_denial"],
      "success_criteria": "计划精确冻结 Release、Schema、预算和策略，草稿、策略故障与数据库旁路均失败关闭。"
    },
    {
      "scenario_id": "p413-current-policy-006",
      "title": "当前权限、套餐与跨空间授权复核",
      "capability": "current_policy_authorization",
      "source_case_refs": ["p401-cross-workspace-denied-006", "p401-permission-revoked-denied-007"],
      "pytest_node": "tests/unit/test_p402_tool_catalog.py::test_catalog_cross_workspace_inactive_plan_and_unknown_version_fail_closed",
      "expected_case_count": 1,
      "verified_invariants": ["p4_current_policy_recheck", "p4_read_write_permission_separation"],
      "verified_gates": ["unauthorized_tool_denial"],
      "success_criteria": "跨空间、权限撤销、套餐失效和未知版本不会因历史 Release 或前端可见性而放行。"
    },
    {
      "scenario_id": "p413-personal-confirmation-007",
      "title": "个人高风险确认绑定当前 PDP",
      "capability": "personal_confirmation",
      "source_case_refs": ["p401-personal-confirmation-required-009", "p401-stale-confirmation-denied-010"],
      "pytest_node": "tests/integration/test_p406_tool_confirmation_postgres.py::test_personal_confirmation_is_idempotent_and_requires_fresh_pdp",
      "expected_case_count": 1,
      "verified_invariants": ["p4_confirmation_digest_binding", "p4_idempotency_before_side_effect"],
      "verified_gates": ["unconfirmed_side_effect_denial"],
      "success_criteria": "个人所有者确认必须绑定冻结参数与当前 PDP，重复、陈旧或越权确认不能执行副作用。"
    },
    {
      "scenario_id": "p413-enterprise-approval-008",
      "title": "企业两级审批与 Agent 生命周期协同",
      "capability": "enterprise_approval",
      "source_case_refs": ["p401-enterprise-approval-pending-012", "p401-enterprise-write-approved-013"],
      "pytest_node": "tests/integration/test_p406_tool_confirmation_postgres.py::test_enterprise_two_level_approval_and_agent_lifecycle_coexist",
      "expected_case_count": 1,
      "verified_invariants": ["p4_confirmation_digest_binding", "p4_idempotency_before_side_effect", "p4_transactional_fact_consistency"],
      "verified_gates": ["unconfirmed_side_effect_denial"],
      "success_criteria": "企业写操作在冻结的两级审批完成前不能进入 ready，审批与 Agent 生命周期使用同一事实源。"
    },
    {
      "scenario_id": "p413-credential-boundary-009",
      "title": "凭证调用边缘注入与结果零泄漏",
      "capability": "credential_boundary",
      "source_case_refs": ["p401-credential-result-leak-020"],
      "pytest_node": "tests/integration/test_p407_tool_credentials_postgres.py::test_callback_result_and_exception_cannot_expose_plaintext",
      "expected_case_count": 1,
      "verified_invariants": ["p4_credential_call_edge_only", "p4_untrusted_result_quarantine"],
      "verified_gates": ["zero_credential_exposure"],
      "success_criteria": "凭证仅在调用回调边缘短时存在，返回值和异常均不能把明文带入持久事实或响应。"
    },
    {
      "scenario_id": "p413-side-effect-idempotency-010",
      "title": "并发重复投递副作用唯一提交",
      "capability": "side_effect_idempotency",
      "source_case_refs": ["p401-idempotent-replay-014"],
      "pytest_node": "tests/integration/test_p408_side_effect_idempotency_postgres.py::test_concurrent_duplicate_delivery_has_one_adapter_call_owner",
      "expected_case_count": 1,
      "verified_invariants": ["p4_idempotency_before_side_effect", "p4_transactional_fact_consistency"],
      "verified_gates": ["zero_duplicate_side_effect"],
      "success_criteria": "并发重复投递只有一个 Adapter 调用所有者，重复外部副作用严格为零。"
    },
    {
      "scenario_id": "p413-response-loss-011",
      "title": "响应丢失后的未知结果人工恢复",
      "capability": "response_loss_recovery",
      "source_case_refs": ["p401-outcome-unknown-manual-016"],
      "pytest_node": "tests/integration/test_p408_side_effect_idempotency_postgres.py::test_committed_side_effect_with_lost_response_can_only_be_reconciled",
      "expected_case_count": 1,
      "verified_invariants": ["p4_idempotency_before_side_effect", "p4_bounded_retry_and_terminal_precedence"],
      "verified_gates": ["zero_duplicate_side_effect"],
      "success_criteria": "副作用已提交但响应丢失时只能进入人工核对，不得自动重放未知结果。"
    },
    {
      "scenario_id": "p413-cancellation-precedence-012",
      "title": "取消、租约与迟到成功优先级",
      "capability": "cancellation_precedence",
      "source_case_refs": ["p401-cancel-running-attempt-018", "p401-late-success-ignored-019"],
      "pytest_node": "tests/integration/test_p409_tool_recovery_postgres.py::test_lease_renewal_cancellation_observation_and_late_success_precedence",
      "expected_case_count": 1,
      "verified_invariants": ["p4_bounded_retry_and_terminal_precedence", "p4_transactional_fact_consistency"],
      "verified_gates": ["cancellation_late_result_precedence"],
      "success_criteria": "Worker 观察取消后停止续租，迟到成功不能覆盖取消或超时终态。"
    },
    {
      "scenario_id": "p413-result-operations-013",
      "title": "结果安全、用量、SSE 与审计事实",
      "capability": "result_usage_sse_audit",